{
  "eventId": "evt_dlq_aaaaaaaaaaaaaaaaaaaaaaaaaaaaaaaa",
  "eventType": "rag.index-requested.v1",
  "occurredAt": "2026-08-22T00:00:00Z",
  "partitionKey": "hmac-sha256:6666666666666666666666666666666666666666666666666666666666666666",
  "payloadHash": "sha256:7777777777777777777777777777777777777777777777777777777777777777",
  "references": {
    "attempt": 1,
    "eventId": "evt_rag_index_00000001",
    "eventType": "rag.index-requested.v1",
    "failureCode": "INVALID_EVENT_PAYLOAD",
    "payloadHash": "sha256:2222222222222222222222222222222222222222222222222222222222222222",
    "sourceTopic": "rag.index-requested.v1"
  },
  "schemaVersion": 1
}
